21,Jhonathan Venegas,Hospital Universitario San Ignacio,2021-12-12T13:10:27Z,2021-12-02T00:00:00Z,IPS,Viviana Andrea Pinzón,Angélica Ortiz.,Bogotá D.C.,Carrera 7 # 40 – 62,vapinzon@husi.org.co,5946161 ext 1045,Viviana Andrea Pinzón,5946161 ext 1045,vapinzon@husi.org.co,"11 químicos farmacéuticos (1) adecuaciones, coordinadora, parametrización, distribución y dispensación.
 11 regentes en farmacia. Todos con controlados, reportes de farmacias satélites.
 34 auxiliares de farmacia. Directamente, debido a que son los responsables de la dispensación.",QF: 11; RF: 11; AF: 34;,"Solo la DT. 
Regentes, manejo de informes y dispensación y distribución.",Sí,Sí,"Si. 
Cada año.
Se evalúa por medio de un Google forms.
Recapacitación.",Sí,Una vez al año,Sí,No,Algo inconforme,"Inconformidad. Por medio de los médicos, debido a recargar el trabajo del médico, doble trabajo. Mipres y formula interna.","Centralizada. Complejo en el listado, de acuerdo a la versión, se habilitan cosas que no están. Consulta permanente con Minsalud para saber porque deshabilitan etc.
Parametrización. Tabletas, vs, la pagina del Invima, no coindicen las presentaciones y FF.
Formatos de contingencia.
Cum no activo en MIPRES.
",Negativa,Que se permita hacer la interfaz con la prescripción del Hospital.,Negativa,NA,Software,SAHI,Correo electrónico,NA,"A través del sistema de información, calculan los consumos de los 12 meses, con base en eso se hace la proyección en la última semana del mes. Stock mínimo de 5 días, verificación manual.",Software,SAHI,Un día completo.,Un día,2,3,"Monta el pedido a la oficina de compra. sé el envía la cotización, la oficina tramita el anticipo. con base en la cotización y el pedido, y genera la orden de compra. Tesorería programa del pago. Realización del pago, papeles y validación con carta ante el FNE.",Mensualmente,Mensualmente,En general sí.,Sí,NA,Muy conforme,Muy conforme,NA,"Software, registro de la recepción y se registra todo allí. El muestreo se realiza por medio de la militar estándar.",Los medicamentos son ubicados en área de cuarentena exclusiva para MME y se reporta al FNE.,nO,No,"Recepción técnica, almacenamiento. Rotos y vencido. Contratos de regentes. 
Acta de corresponsabilidad.
",No,"Auxiliar va hasta el FNE en carro propio del hospital, y realiza una inspección del pedido",Si están de acuerdo.,Sí,NA,Muebles especiales con llave. En la bodega una celda aparte para controlados.,Gabinete exclusivo bajo llave; Celda para controlados,Regentes. Una por turno.,QF: 1; RF: 1; AF: 0;,Lapwar. Continuo. Automatizado.,Continuo,Anual se calibra,Cada año,Si. Rojo 3 meses.,Sí,R3,Sí,"Canasta dentro del mueble. 
Área de rotos y vencidos aparte.
","No es difícil, proceso muy sencillo. Presentación comercial y unidades.",Ecoentorno.,EcoEntorno,Demorado la cita de destrucción.,Sí,Para 5 días,5,Comparación con movimientos históricos,12,1,"Morfina IM multidosis. Baja rotación y estabilidad. 
Y adecuaciones por estabilidades.
",Morfina solución 10mg/mL;,7,Enfermería hace conteo mensual. Auditoría anual con los carros de paro.,NA,No.,No,No. Pero estaría de acuerdo para que el hospital lo implemente.,No,Muy importante. Ya se etsa implementado en el servicio con otros medicamentos. Morfina e hidromorfona.,No. Prescripción para 24 horas.,1,No,NA,NA,NA,NA,Hoja de cálculo formato estándar,NA,"El primer día, se toman las fórmulas, se cuentan y se validad. Este se reporta al DT y se consolida en el anexo.",1 a 2 días,8-10 día del mes,No,Sí,"Salvo el de farmacovigilancia con hidromorfona, no.",NA,Sí,Sí,"Morfina e hidromorfona.
Alpharma.
Dosis unitaria.400 dosis unitarias al día.
Egresos de inventario, con el terceo. Cálculos de dosis, se envía al tercero. El tercero reclama en el hospital junto con los formatos. Al final se hace la validación de las adecuaciones hechas.",Solución salina + Morfina; Solución salina + Hidromorfona; Solución salina + Metadona,No,Solo hospitalario.,NA,Algo inconforme.  Dosis con estándar internacional. Hidromorfona 2mg/mL. Cuando se maneja de 0.6 mg.,Algo inconforme,"Se dispensa según la prescripción. Observación, debería hacerse el ajuste de gotas. El remanente se destruye.",Sí,"No se maneja.
Por baja rotación.
",No,"10 y 100.
Pediátrico y pacientes con algún Dx del SNC,
",Fenobarbital tableta x 10mg; Fenobarbital tableta x 100mg;,No,No,El tema de reempaque es difícil. El de nacional es mejor por su presentación.,Sí,NA,Algo conforme,"Para consultas son muy demorados, de resto no hay problema.",Ser mas oportunos,No,No,Estabilidades de morfina e hidromorfona propios para dosis unitarias.
22,Guillermo Leal,Hospital Cardiovascular,2021-12-12T18:32:03Z,2021-11-18T00:00:00Z,IPS,Vilma Berrio,Julian Jimenez,Cundinamarca,"Carrera 4 este #31-88 san mateo, Soacha",dirección@hcssa.com.co,NA,Ricardo Olaya,320 449 8599,compras@hccsa.com.co,"4 QF, 3RF, 28 AUX.",QF: 4; RF: 3; AF: 28;,Si esta en los contratos,Sí,No,"Se hace una vez al año, no es especifica sino mas bien general de todos los medicamentos y se pasa con nota de 3",Sí,Una vez al año,Sí,No,Ni conforme ni inconforme,Se esperaria se pueda integrar con los software institucionales y vengan con capacitaciones para su optimo manejo,"Dificil en un inicio con los medicos pero poco a poco se ha mejorado esa parte, se espera poder integrar con el otro software para nho tener reprocesos",Positiva,La dificultad principal es la falta de integración del software institucional con el de ministerio haciendo que sea un proceso doble,Negativa,"Los medicos tienen problema con las concentraciones, en las magistrales con algunos principios activos las presentaciones no coinciden",Software,E-medial club,Correo electrónico,"La comunicación es oportuna, se solicita si es posible generar alertas de desabastecimientos para tener en cuenta y asi poder manejar diversas situaciones que se presentan",Descarga el consumo historico del software mensual,Software,"E-medical club, Excel",1,Un día,5,1,"Se envía desde farmacia el pedido general de proyección al mes de acuerdo con los consumos, se envía al FNE desde el área de compras. No hay niveles mínimos.",Mensual,Mensualmente,"Hubo inconvenientes con pedidos de fenobarbital 40 mg, pero generalmente se despacha el 100%",Sí,Fenobarbital Solución 40mg/mL,Algo conforme,Algo conforme,Todo seria mas rapido si se tuviera PSE,"Se realiza la recepción documental y de producto, la regente hace el ingreso en el sistema. Después pasa a la bodega. Se hace la revisión al 100%",Se reportaría al FNE con evidencia fotográfica,No se han tenido casos de medicamentos no conformes o averiados. No se han tenido desvíos ni robos.,No,"Recepción, Distribución, Sedación.",No,"El proceso de reposición se hace con el proveedor con una nota crédito a la cuenta factura, se hace un nuevo ingreso con el producto nuevo","Habría inconvenientes con la EPS, si hay sobrecostos dentro del producto debe informárseles",No,La rta depende de lo economico,"Hay una gaveta bajo llave en un espacio privado, en custodia, hay dos llaves en farmacia y administrativa",Gabinete exclusivo bajo llave; Acceso de personal restringido;,El auxiliar de farmacia en custodia del turno y el químico farmacéutico,QF: 1; RF: 1; AF: 0;,"Si, dos veces al día",Dos veces al día,"Termohigrómetro, se calibra cada año",Cada año,"Si, semaforización rojo 6 meses, marcación LASA.",Sí,R6,Sí,Sí,Fue hasta la planta de Mondoñedo a hacer la destrucción. Queda un acta de lo que se destruye.,"Ecoentorno, tiene licencia ambiental",EcoEntorno,"Se manejan libros, un libro por cada medicamento. Se guarda documentación por 5 años.",No,NA,NA,No se tienen reglas de decisión,12,1,No,NA,3,19 carros de paro // auditorias en acompañamiento a enfermeria,CP19;,no,No,"No se usa código de barras, pero se desea implementar. Esta en proceso, ya se avanzó poniendo wifi en todo el hospital",No,"Opinión muy conforme, pero debería tener dentro del código de barras toda la información técnica",Sí,1,No,NA,NA,NA,NA,Hoja de cálculo formato estándar,NA,"En el sistema se toman las fechas dentro del mes, se buscan inconsistencias, se contrasta movimientos con el libro y se envía con el visto bueno de la directora técnica del servicio farmacéutico",más de 2 días,8-10 día del mes,No,No,"Si, la alerta de hidromorfona llegó a un paciente que presentó choque séptico, infección y se reportó a Invima por Vigiflow. Ya se hizo la reposición.",Se maneja copia para separar fórmulas de medicamentos que llevan 2 MCE cuando están en la misma fórmula.,Sí,No,NA,NA,No,na,NA,Bastante conforme,Muy conforme,NA,?,No se usa,No,Los tres e igual dicen que son dosis muy grandes para pediatria,Fenobarbital tableta x 10mg; Fenobarbital tableta x 50mg; Fenobarbital tableta x 100mg;,Fenobarbital para dosis pediátrica,Sí,NA,Sí,NA,Algo conforme,La respuesta es generalmente oportuna y rápida,ninguna,Se deberían hacer alertas de desabastecimiento como hace Invima con las alertas sanitarias,No,No observaciones
23,Nicolás Alexander Cadena Ayala,Éticos Ltda,2021-12-13T00:34:11Z,2021-11-10T00:00:00Z,OL,Yansi Paola Devia Quintero,Francisco Manuel Viera Tuiran,CUNDINAMARCA,Autopista Medellin Km 3.5 Costado Norte Bod 53 y 54 (COTA),regenteinscota@eticos.com,NA,NA,NA,NA,"En bodega principal de ETICOS:
- QFs: 1
- Regente en Farmacia: 2
- Auxiliar de farmacia: 0
En cada punto de dispensación de los 27 en todo el territorio nacional:
- QFs: 1
- Auxiliar de farmacia: 1",QF: 1; RF: 2; AF: 0;,Si,Sí,Sí,"Si. Anualmente, no obstante no hay evidencia de evaluación de estas capacitaciones.",Sí,Una vez al año,No,No,Muy conforme,Les quitaría tantas limitaciones que tienen con la prescripción por parte de los facultativos.,"ÉTICOS LTDA fueron pioneros en el manejo de MIPRES, no obstante no tienen ninguna opinión o comentario al respecto de la plataforma digital.",Neutral,Sin opiniones,Neutral,NA,Software,Advanced,"Telefono, Correo electrónico","Programa Advanced en bodega central Cota ETICOS LTDA.
Programa EPOS en cada punto de dispensación, cuyo software recibe trasferencias de Advanced","La Regente de farmacia y el Químico Farmacéutico consolidan una tabla en Excel, donde se proyectan las unidades de medicamentos, considerando el número de dispensaciones, stock actual y posfechados.",Paquete ofimático,Excel,1,Un día,1,1,"Una vez proyectado el número de unidades, esta información pasa al área contable para aprobar el pago. ETICOS LTDA no tiene compra centralizada de MME a nivel nacional, por lo contrario, cada punto de dispensación solicita MME dependiendo su necesidad. Anteriormente las compras estaban centralizadas, pero se presentaron dificultades y por decisiones gerenciales se adoptó esta estrategia. Cada punto tiene su propia Resolución y  hace su respectivo informe – Anexo 13.",Mensualmente,Mensualmente,"Sí, no obstante se han presentado casos de desabastecimiento para los siguientes medicamentos: Primidona, Hidromorfona, Morfina, Metilfenidato 10 mg particularmente",Sí,Primidona Tab x 250mg; Hidromorfona Solución 2mg/mL; Morfina Solución 10mg/mL; Metilfenidato Tab x 10 mg,Muy conforme,Algo conforme,"El punto de dispensación más grande para el manejo de MME es el Hospital Militar (Bogotá D.C)
En los siguientes FRE se han presentado desabastecimientos de MME:
•	FRE Meta
•	FRE Valle del Cauca
•	FRE Barranquilla
•	FRE Sincelejo",Lo hace el Químico Farmacéutico o la Regente en farmacia. Se revisan todas las unidades y se compara información de lotes y fechas de vencimiento. Todo el proceso toma 2 horas.,Cada punto de dispensación notifica la novedad al Químico Farmacéutico (DT) de la bodega central.  Francisco Manuel Viera Tuiran se comunica con el FNE para presentar la inconsistencia. Todo queda registrado en el Acta de recepción técnica,No,No,Manual de procedimiento Manejo De Medicamentos De Control Especial Y Monopolio Del Estado (PR.LA.005),Sí,En el caso de la Hidromorfona 2mg/mL relacionado a la alerta sanitaria del INVIMA se recogieron 100 unidades a una paciente y se realizó seguimiento farmacoterapéutico para evaluar riesgo de contaminación bacteriana.,"Si estarían de acuerdo, pero depende del tiempo estimado del transporte de los medicamentos a la bodega central de ETICOS LTDA.",Sí,"Las empresas contratadas para cualquier traslado interdepartamentales son: Servientrega, Openmarketing, Alianza","El almacenamiento de los MCE está ubicado en un área exclusiva de la bodega central, cuyo acceso personal es restringido. Los gabinetes de los medicamentos están bajo llave, única copia. Adicionalmente, hay cámaras de seguridad circuito cerrado, cuyo control perimetral es completo.",Gabinete exclusivo bajo llave; Acceso de personal restringido; Cámaras de seguridad;,"4
•	1 Químico farmacéutico - Francisco Manuel Viera Tuiran
•	1 Regente de farmacia – Yansi Paola Devia Quintero
•	2 Auxiliares operativos",QF: 1; RF: 1; AF: 0;,Diariamente dos veces al día (9 am y 3pm),Dos veces al día,"Termohigrómetro, cuya calibración es anual.",Cada año,"Si esta implementada en el sistema, en las unidades físicas no hay sticker. Por sistema se controlan fechas de vencimiento.
Cuando falten 3 meses para vencimiento, solicitan devolución con el proveedor.",Sí,R3,Sí,"Está ubicada en el cuarto exclusivo de MCE, en un gabinete diferente de estos medicamentos, pero bajo custodia con acceso restringido.","No se hace en la Bodega de ETICOS LTDA Cota, pero si lo hace cada punto de dispensación con permiso del FRE que corresponda.
Anteriormente cuando tenían medicamentos de baja rotación, se destinaba para donación en vez de la destrucción final.","Empresa Syntia Química, tienen licencia ambiental. ETICOS LTDA exige la certificación de licencia ambiental",Syntia Química,NA,Sí,"Cada punto de dispensación maneja su inventario, con los niveles de seguridad particulares en cada punto. La bodega central de ETICOS LTDA Cota solicita información de los movimientos de inventario en cada punto, facilitando la distribución a nivel nacional, con el fin de evitar desabastecimientos y productos próximos a vencer.",?,Comparación con movimientos históricos,12,2,No,NA,7,NA,NA,No,No,"Si son usados con los MCE, sería ideal que el FNE implementara códigos de barras en los MME para brindar beneficios a la trazabilidad",Sí,Sería ideal que el FNE usara stickers para diferenciar los MME,NA,NA,NA,NA,NA,NA,NA,Hoja de cálculo formato estándar,NA,"Se considera la información del Anexo 13 del mes anterior, y los movimientos mensuales registrados en el software. El diligenciamiento actualmente lo hace el Químico Farmacéutico, pero se está entrenando a la Regente en farmacia para hacerlo.",más de 2 días,8-10 día del mes,Sí,Sï,"Si tienen programa de FV. Las notificaciones de la secretaria de salud y el INVIMA referentes a MME y MCE son acogidas y documentadas. Por ejemplo, la Alerta sanitaria de la Hidromorfona 2mg/mL quedó registrado.",NA,Sí,No,NA,NA,No,NA,NA,NA,NA,NA,NA,No tiene rotación en los puntos de dispensación,Sí,Mayormente se usa el fenobarbital 100 mg en el Hospital Militar,Fenobarbital tableta x 100mg;,No,No,NA,NA,NA,Muy conforme,No hay queja alguna de la comunicación con el FNE,Ninguno,Si,Sí,"Sería ideal que el FNE abriera una línea de crédito en la compra de medicamentos (máximo 15 días), con el fin de agilizar trámites internos para generar el desembolso del valor económico de los medicamentos."
24,Nicolás Alexander Cadena Ayala,Hospital San Rafael Cáqueza,2021-12-13T00:44:29Z,2021-11-12T00:00:00Z,IPS,Sergio Alexander Cáceres Peñuela,Daniel Felipe Dimaté,CUNDINAMARCA,Av. 5 # 5 – 80 (Cáqueza),farmacia.ese.caqueza@gmail.com,3182341667,Keila Jimena Caviativa Velásquez,3182341667,farmacia.ese.caqueza@gmail.com,"1 Químico farmacéutico
1 Regente en farmacia
5 Auxiliares en Farmacia",QF: 1; RF: 1; AF: 5;,"Únicamente el Químico farmacéutico, los demás no tienen estas obligaciones.",Sí,No,No,No,NA,NA,No,Muy conforme,"La estandarización del formato de prescripción tiene grandes ventajas, ya que todas las prescripciones que reciban por parte de los médicos no tendrán errores, cuyo inconveniente es frecuente en el hospital. Así mismo, están de acuerdo por la trazabilidad de estos documentos.",Al principio los médicos mostraron resistencia al cambio con la implementación de MIPRES. No lo usaban ya que la plataforma no es intuitiva y se demoran prescribiendo el medicamento.,Negativa,"Se debe tener en cuenta la facilidad en la búsqueda del medicamento en la herramienta MIPRES, para evitar tiempos extensos de prescripción. Los médicos no prescriben si es muy complicado el proceso de prescripción.",Negativa,NA,Software,Dynamica Gerencial,Correo electrónico,NA,"El Químico farmacéutico estima la cantidad de medicamentos a partir de una matriz en Excel “Cálculo de controlados”, considerando el comportamiento histórico de los últimos meses, el stock actual y disponibilidad presupuestal interna en el Hospital.","Paquete ofimático, Software","Dynamica Gerencial, Excel",5,Cinco días,2,1,"Desde la farmacia se fija la cantidad de medicamentos a comprar, este dato es revisado y ajustado por el Área de presupuesto. Por política interna el tope de compra de medicamentos no puede ser superior a 4.500.000 COP. Posteriormente la documentación pasa al Área de Tesorería, donde puede tardar hasta un mes en ser aprobada. Esta área se encarga de hacer cotización y solicitud de medicamentos. Finalmente, el conductor de la ambulancia del hospital se dirige al FNE para recoger estos medicamentos.",Cada 3 meses,Cada tres meses,Si,Sí,NA,Muy conforme,Muy conforme,NA,"La auxiliar de farmacia se encarga de este proceso, cuando recibe los medicamentos directamente de la ambulancia. Hace un muestreo tipo Militar Standard para revisar algunas unidades, verificando fechas de vencimiento y lotes","Se ubican los medicamentos en el Área de cuarentena y se comunican con Keila Jimena Caviativa Velásquez, responsable de compras de MME para hacer la notificación al FNE.",No,No,No existen Manuales de procedimientos relacionados particularmente con MME y/o MCE,No,No ha sucedido,"Estarían muy de acuerdo, ya que programar el desplazamiento de la ambulancia para recoger los MME a Bogotá D.C es difícil",Sí,NA,"Los gabinetes tienen candado, pero no están bajo llave gran parte del tiempo, en vista del proceso de dispensación. Única copia de la llave. Control diario de MME y Cámara de seguridad circuito cerrado.",Gabinete exclusivo bajo llave; Cámaras de seguridad;,"Los responsables del manejo de medicamentos controlados son los 5 Auxiliares de farmacia, el regente de farmacia y el Químico farmacéutico.",QF: 1; RF: 1; AF: 0;,"Diariamente, dos veces al día",Dos veces al día,"Termohigrómetro, calibrado cada año.",Cada año,"Si.
Únicamente Rojo: menor de 6 meses",Sí,R6,Sí,"Dispuesto en otro gabinete diferente de los medicamentos controlados, no está bajo llave.",No han tenido estos casos. El responsable sería el ingeniero ambiental del Hospital,No hay convenio con alguna empresa,NA,NA,Sí,"En la matriz del cálculo de unidades de medicamentos controlados, se contempla un nivel de inventario mínimo, cuya cantidad se busca mantener siempre.",?,Comparación con movimientos históricos,4,3,No,NA,1,"7 Carros de paro
1 Ambulancia",CP7;,No,No,No,No,Ninguna,Sí,1,Sí,NA,NA,NA,NA,Hoja de cálculo formato estándar,NA,"Se miran los informes enviados anteriormente al FNE. Igualmente se cotejan 3 elementos: Kardex extraído del software Dinámica Gerencial, conteo unidades físicas y unidades del inventario en Excel. Confirman si los saldos coinciden.",más de 2 días,8-10 día del mes,No,El error de unidades se ajusta al informe Anexo 13 del siguiente mes. No se notifica la corrección del error.,No,NA,No,No,NA,NA,No,NA,NA,Conforme,Algo conforme,NA,?,NA,Sí,NA,Fenobarbital tableta x 10mg; Fenobarbital tableta x 50mg; Fenobarbital tableta x 100mg; Fenobarbital Solución 0.4%,Actualmente conforme,No,Ninguna impacto,No,NA,Algo conforme,Comunicación por teléfono algunas veces tiene fallas,Ideal que el FNE pueda ampliar los horarios de atención,Si,Sí,"Ideal que el FNE emita pre-factura o factura final antes de la entrega de medicamentos, ya que actualmente se solicita el pago de estos MME con el formato de cotización de medicamentos y para los procesos presupuestales internos podría ser mejor gestionar el pago con una  pre-factura o factura final."
