ID,Nombre_encuestador,Nombre_institución,Marca_temporal,Fecha,Tipo,Nombre_funcionario_1,Nombre_funcionario_2,Departameto,Dirección,Correo_correspondencia,Telefono_12,Nombre,Telefono_14,Correo_electrónico,2.01_Cuántos_Químicos_Farmacéu,2.01_Composicion,2.02_En_los_contratos_o_en_los,2.02_Explicado,2.03_Poseen_carta_de_correspon,2.04_Usted_realiza_capacitacio,2.04_Explicado,2.04_Frecuencia,2.04_Evaluar,3.01._Conoce_la_iniciativa_FNE,3.02._Qué_tan_de_acuerdo_se_en,3.03._Justifique_la_respuesta,3.04_Qué_opinión_tiene_respect,3.04_Explicado,3.05_Usted_qué_opina_de_que_el,3.05_Explicado,Observaciones_32,4.01._Con_cuales_herramientas_,Si_la_respuesta_anterior_fue_p,4.02._Qué_medios_utiliza_de_ma,Observaciones_36,4.11._Describa_el_proceso_que_,4.12._Qué_herramienta_utiliza_,Si_la_respuesta_anterior_fue_p,4.13._Cuánto_tiempo_toma_la_et,4.13_Explicado,4.14._Cuánto_tiempo_toma_la_so,4.15._Cuánto_tiempo_toma_el_de,4.16._Descripción_proceso_de_c,4.17._En_qué_meses_suelen_real,4.17._Explicado,4.18._La_cantidad_solicitada_a,4.18_Explicada,4.18_Medicamentos,4.19._Qué_percepción_tiene_pro,4.20._Qué_tan_conforme_se_encu,Observaciones_52,4.21_Describa_el_proceso_de_re,4.22._Cómo_es_el_manejo_de_pro,4.23._Se_han_presentado_no_con,4.23_Explicado,4.24._Lista_de_procedimientos_,4.24_POE_MCE,4.25_Cómo_es_el_proceso_de_rec,4.26_Consideraría_que_el_trans,4.26_Explicado,Observaciones_62,4.30_Con_que_medidas_de_seguri,4.30_Explicado,4.31_Cuantas_personas_y_quiene,4.31_Explicado,4.32_Cada_cuanto_se_hace_revis,4.32_Explicado,4.33_Qué_instrumento_se_usa_pa,4.33_Frecuencia,4.34_Se_tiene_semaforización_d,4.34_Explicado,4.34_Umbral,4.35_Usa_técnicas_FIFO_y_FEFO,4.36_Donde_tiene_el_área_de_cu,4.37_Cómo_se_maneja_la_disposi,4.38_Qué_empresa_se_encarga_di,4.38_Explicado,Observaciones_79,4.40._Tiene_niveles_de_segurid,4.41._En_caso_que_la_pregunta_,4.41_Explicado,4.43._Tiene_reglas_de_decisión,4.43._Con_qué_frecuencia_númer,4.44._Cuándo_se_realizan_compr,4.45_Ha_presentado_unidades_ve,4.45_Explicado,4.46_Cuantos_servicios_farmacé,4.47_Aparte_de_los_servicios_f,4.47_Explicado,4.48_Han_presentado_perdidas_d,4.48_Explicado,4.49_Usted_usa_código_de_barra,4.49_Explicado,Hay_una_visión_positiva_al_res,4.61._Se_tiene_una_prescripció,4.62._Cuántos_MCEMME_se_prescr,4.63._Se_prescriben_MMEMCE_jun,4.71._Describa_cómo_es_el_proc,4.72._Existe_una_estimación_nú,4.73._A_qué_lugares_realiza_la,4.74._Qué_razón_existe_para_la,4.81._Cómo_maneja_el_anexo_13_,Si_la_respuesta_anterior_fue_o,4.82._Cómo_y_a_donde_se_envía_,4.83._Cuánto_tiempo_se_demora_,4.84._En_qué_fecha_enviar_el_A,4.85_Ha_existido_meses_donde_e,4.86_Si_se_observó_un_error_de,4.87_Han_tenido_casos_de_farma,Observaciones_111,4.87_Explicado,4.90._Realiza_la_adecuación_de,4.91._En_caso_de_que_la_pregun,4.90._Detalle,4.92._Realiza_la_elaboración_d,4.93._En_caso_de_que_la_pregun,4.93_Detallado,4.94_Qué_tan_conforme_se_encue,4.94_Detallado,4.95_Si_se_usa_multidosis_morf,4.95_UsoMorfinaOral,4.96_Conoce_el_medicamento_Hid,4.96_Detallado,4.97_Qué_tipo_de_fenobarbital_,4.97_Detallado,4.98_Desde_su_experticia_Consi,4.98_Detallado,4.99_Entre_metadona_importada_,4.99_Detallado,Observaciones_131,5.00._Desde_su_experiencia_qué,5.01._Justifique_la_respuesta_,5.02_Tiene_alguna_recomendació,5.03_Le_parece_que_la_divulgac,5.03_Explicado,5.04_Qué_opinión_sugerencia_u_
2,Nicolás Alexander Cadena Ayala,Coopsumapaz,2021-11-23T00:48:43Z,2021-11-11T00:00:00Z,IPS,Lizeth Jubely Velasquez Cortes,Sandra Rubiela Castellanos Bejarano,CUNDINAMARCA,Calle 9 No. 8 A – 63 (Silvania),coopsumapaz@yahoo.es,3219317052,Sandra Rubiela Castellanos Bejarano,3103425286,sandracastell92@gmail.com,"QFs: 0
Regente en Farmacia: 1
Auxiliar de farmacia 2",QF: 0; RF: 1; AF: 2;,Si tienen obligaciones con los MCE,Sí,Sí,"Si se realizan, pero ninguna está orientada al manejo de MME y MCE.",No,NA,NA,No,Muy conforme,"Unificación del diligenciamiento del recetario oficial por parte de todos los médicos prescriptores, teniendo en cuenta que los médicos no saben cómo formular un MME y MCE. Reciben varias prescripciones con errores.","No tienen opiniones con MIPRES ya que no lo manejan. No obstante, se percibe que hay desconocimiento de como enviar la fórmula médica con el MIPRES.",Neutral,No tiene opiniones.,Neutral,"La prescripción de MME y MCE se hace de manera electrónica y manual.
Toda prescripción de MME y MCE siempre tiene anexada la fotocopia de la cedula paciente",Software,Medicare,"Telefono, Correo electrónico",NA,"La regente en farmacia estima la necesidad de compra por medio de un Excel. Esta tabla considera el comportamiento del consumo mensual (últimos 3 meses), las cantidades de medicamentos actuales, y se incrementa un colchón del 10%.",Paquete ofimático,Excel,1,Un día,1,1,"Regente en farmacia fija la cantidad de medicamentos y pasa la información al área financiera para continuar con el proceso. Sandra Castellanos hace la cotización y solicitud con el FNE, posteriormente hace el pago de los medicamentos. Finalmente envían una persona con carta de autorización, para recoger los medicamentos",Mensualmente,Mensualmente,Si,Sí,Primidona Tab x 250mg,Muy conforme,Muy conforme,"Desabastecimiento de PIRIMIDONA por parte del FNE.
Algunas veces llega un médico al territorio y se incrementa la prescripción de un medicamento en particular. Luego, el médico deja de prescribirlo y el medicamento deja de rotar. Queda represado en el área de almacenamiento. Ejemplo: Oxicodona 20mg","La Regente en farmacia recibe los medicamentos y verifica la cantidad de medicamentos solicitados. Así mismo las fechas de vencimiento y lotes. Posteriormente son ingresados en el sistema y se firma el Acta de Recepción.
Tiempo aproximado 30 minutos",Inmediatamente comunicaban el caso a Sandra Castellanos para que lo notifique al FNE y registre la novedad. Los medicamentos se ubican en el área de cuarentena.,No,No,"•	Manual de Manejo de Medicamentos de Control (AT-PR-05)
•	Manual dispensación y manejo de medicamentos controlados (AT-PR-13)",Sí,No han tenido casos,Opinión muy positiva.,Sí,NA,"Gavetas con única llave, manejada por la Regente en farmacia",Gabinete exclusivo bajo llave,1,QF: 0; RF: 1; AF: 1;,Diariamente dos veces al día. Mañana (8am) y tarde (12:30pm),Dos veces al día,Termohigrómetro es calibrado cada seis meses,Cada 6 meses,"Si. Verde: 6 meses, Amarillo: 4 meses, Rojo: 1 mes",Sí,R1A4V6,Sí,Área ubicada en una gaveta diferente al almacenamiento de MME y MCE. Está bajo llave.,"Aproximadamente cada 6 meses se hace, cuando hay suficientes unidades para hacer la solicitud. Se llena Anexo 6, y se separan por lotes. El FNE notifica el día de la cita para destrucción.","Prosarc, si tienen licencia ambiental",Prosarc,Sucedió un caso de robo de MME con un envío de medicamentos a la casa del paciente. Se realizaron denuncias a las respectivas autoridades y notificación al FNE,Sí,Cada 8 días se hace inventario de MME y MCE para verificar cantidades y evitar desabastecimiento.,?,Comparación con movimientos históricos,12,1,No,NA,1,No,No,Si. Esperan una cantidad suficiente para solicitar destrucción de medicamentos.,Sí,No,No,Si están de acuerdo.,NA,1,NA,NA,NA,NA,NA,Hoja de cálculo formato estándar,NA,La regente de farmacia consolida la información y envía el informe al correo del FNE: anexofne@minsalud.gov.co. Suele enviarlo los primeros 3 días del mes,0  a 2 horas,1-3 día del mes,No,Sí,"Si manejan FV, tienen matriz para registrar casos de FV (caso del paciente, datos del paciente, nombre medicamento, información formato del INVIMA.",NA,Sí,No,NA,NA,No,NA,NA,Conforme,Algo conforme,NA,No,No,No,NA,NA,No,No,Metadona nacional es mejor para la dispensación de medicamentos.,Sí,NA,Muy conforme,La comunicación es muy buena por correo electrónico y celular,Ninguna,Está de acuerdo con recibir notificaciones por correo del punto de dispensación,No,"El horario de entrega de los medicamentos no debería ser exclusiva los martes y jueves, ya que es difícil el mensajero"
6,Nicolás Alexander Cadena Ayala,Centro de Investigaciones Oncológicas Clínica San Diego,2021-11-24T23:59:36Z,2021-10-27T00:00:00Z,IPS,Fernando Durán Graterol,Elma Johana Espinosa,Bogotá D.C,Avenida Calle 33 # 14 – 37,dtfarmacia.ciosad@gmail.com,3053690134,Elma Johana Espinosa Narvaez,3053690134,compras@ciosad.com.co,"- QFs: 1
- Regente en Farmacia: 1
- Auxiliar de farmacia: 0",QF: 1; RF: 1; AF: 0;,Si,Sí,No,"Personal del servicio farmacéutico recibe capacitaciones en dos ocasiones al año. Así mismo, se capacita al personal nuevo.",Sí,Dos veces por año,Sí,No,Algo inconforme,"La propuesta del ROE incluye diferentes ventajas para el correcto manejo del Recetario Oficial, no obstante, esta implementación debe contemplar algunas limitaciones, particularmente con la resistencia al cambio por parte del médico prescriptor, ya que el diligenciamiento de esta prescripción electrónica es algo nuevo.",Expectativas positivas de la plataforma MIPRES en la IPS,Positiva,No tendría mayores inconvenientes.,Positiva,NA,Manual,Manual,"Telefono, Correo electrónico",NA,"Es un proceso manual llevado a cabo por la Regente en Farmacia y el Químico Farmacéutico. Inicialmente revisan el consumo de estos de medicamentos 6 meses antes y fijan la cantidad promedio mensual. Posteriormente, estiman una proyección de compra para 45 días, considerando que la IPS compra MME para 1 mes, el personal contempla un colchón de 15 días. Finalmente, esta estimación de compra de MME pasa al Área de Compras de la IPS CIOSAD, cuya dependencia es la responsable de la adquisición de medicamentos. El servicio farmacéutico mantiene buena relación con el área de compras.","Manual, Software",CMT,1,Un día,NA,1,"Posterior a la estimación de compra por parte del personal de farmacia, esta información es subida a la plataforma interna de la IPS, CMT. Este programa está conectado con todas las dependencias internas de la IPS. La información de la estimación de compra de MME es revisada por el Área de Compras y validada para la adquisición de medicamentos. Luego, la cotización pasa al departamento de Tesorería para su respectivo pago. El tiempo estimado de todo el proceso de compra corresponde a 8 días, considerando  el tiempo que toma el mensajero recogiendo los medicamentos en el FNE.",Mensualmente,Mensualmente,Si,Sí,No menciona,Algo conforme,Muy conforme,NA,"Una vez el mensajero llega con los medicamentos a la IPS, la Regente en farmacia hace la recepción técnica. El proceso tarda menos de 1 día y queda evidenciado en el Acta de recepción técnica.","En caso de producto no conforme o averías, el personal tomaría evidencia fotográfica y levantan la novedad a partir del formato diseñado para el proceso. Además, comunican la novedad por medio de correo electrónico al FNE. Los medicamentos involucrados son dispuestos en el área de cuarentena",No,No,Procedimiento para el Manejo Medicamentos de Control especial (PR-GTSF-08-SD),Sí,No ha sucedido,Opinión neutra,Sí,NA,Gabinete exclusivo bajo llave,Gabinete exclusivo bajo llave,"1 QF
1 Regente en farmacia",QF: 1; RF: 1; AF: 0;,"Diariamente, dos veces",Dos veces al día,"El termohigrómetro es cambiado cada año, correspondiendo una responsabilidad por parte de los ingenieros biomédicos en el programa: Acciones correctivas y preventivas",Cada año,"Se maneja semaforización (Rojo: menor a 6 meses, Amarillo: entre 6 - 12 meses, Verde: mayor a 12 meses)",Sí,R6A12,Sí,Ubicado en espacio diferente del gabinete de almacenamiento de MME.,No ha sucedido,"EcoEntorno, si tienen licencia",EcoEntorno,NA,Sí,"Mantienen un inventario diario para estos medicamentos controlados. Además, la estimación de consumo mensual se hace para 45 días, conservando 15 días de colchón.",60,Niveles de inventario mínimo,12,1.5,"Se han vencido medicamentos, en estos casos se realizó la destrucción respectiva con el Acta de destrucción y el acompañamiento correspondiente.  Entre los medicamentos involucrados, Lorazepam por baja rotación. Alprazolam, Meperidina y Morfina",Morfina solución 10mg/mL; Meperidina 100 mg/2mL;,1,Carros de paro,No,No,No,"Si, estaría bien",Sí,Ideal para diferenciarlos,No,1,No,NA,NA,NA,NA,Hoja de cálculo formato estándar,NA,"El informe es proyectado por la Regente en Farmacia, en la Hoja de Excel estandarizada por el FNE para hacer este Anexo 13. Compara información disponible en el Libro de Controlados y el inventario de medicamentos. El documento es auditado por el Químico Farmacéutico Director. El proceso de consolidación tarda 3 días.",más de 2 días,1-3 día del mes,No,No,No,NA,No,No,"Según las condiciones actuales de los pacientes, IPS CIOSAD no ha requerido adecuaciones, ya que no tienen pacientes pediátricos.",NA,No,NA,NA,Conforme,Algo conforme,NA,No,No,No,Fenobarbital inyectable 40mg/mL y 200mg/mL y Fenobarbital tableta 100mg,Fenobarbital tableta x 100mg; Fenobarbital solución 40 mg/mL; Fenobarbital solución 200 mg/mL,No,No,Ninguna,No,NA,Algo inconforme,Particularmente en un caso fue imposible la comunicación con el FNE y se originó un inconveniente de despacho con un pedido que ya se había pagado.,Ampliar los canales de comunicación del FNE y horarios de atención,No ya que el oficio donde se notificó la visita técnica por parte del FNE llegó a la carpeta spam y la IPS no estaba enterada.,No,Ninguna
7,Nicolás Alexander Cadena Ayala,Hospital Universitario Mayor – Méderi,2021-11-25T00:09:51Z,2021-10-29T00:00:00Z,IPS,Sandra Patricia Fuentes Diaz,NA,Bogotá D.C,Calle 24 No 29 – 45,sandra.fuentes@mederi.com.co,5600520 ext.3701,Sandra Patricia Fuentes Diaz,5600520 ext.3701,sandra.fuentes@mederi.com.co,"- QFs: 26 pero solo 5 están a cargo de controlados
- Regente en Farmacia: 13
- Auxiliar de farmacia: 104",QF: 26; RF: 13; AF: 104;,Sí,Sí,Sí,Periódicamente realizan capacitaciones para el personal del servicio farmacéutico,Sí,Cada dos meses,Sí,No,Algo inconforme,"La implementación del ROE puede traer muchos beneficios para los pacientes y el personal médico. En IPS MÉDERI ya está instaurada la Historia Clínica Electrónica (HCE) y todas las prescripciones se hacen a través de esta plataforma digital. La prescripción por medio de la HCE es completamente transparente. En general hay expectativas positivas para implementar el ROE en esta IPS, convencidos de que la resistencia al cambio estaría en un menor nivel.","La percepción con MIPRES es muy buena. Los médicos prescriptores tienen acceso a la plataforma MIPRES, por medio de la Historia Clínica Electrónica, por lo tanto no hay inconvenientes.",Positiva,"La plataforma digital debe permitir unificar su sistema con la Historia Clínica Electrónica del Hospital Mederi y el sistema de las otros IPS. De lo contrario, los médicos tendrían que abrir 2 programas alternamente durante la cita y el trabajo se vuelve más complicado. Sería ideal que la plataforma MIPRES permitiera relacionar la plataforma con Historia Clínica Electrónica.",Positiva,NA,Manual,Manual,"Telefono, Correo electrónico",Libros controlados son entregados y firmados en cada turno por el personal asignado. Así que estos libros mantienen actualizados,"El proceso se divide en dos fases: La Microplaneación y la Macroplaneación.
Los responsables de la Microplaneación corresponden a cada encargado de las diferentes farmacias internas que tiene la IPS, definiendo un número y notificando al Almacén semanalmente.
La Macroplaneación es una actividad mensual, cuya responsabilidad es el Área de Logística. El proceso de estimación se basa en el consumo de los últimos 3 meses, lo promedian y adicionan un porcentaje al valor definido. Se lanza planeación cada 25 de cada mes.",Paquete ofimático,Excel,1,Un día,NA,1,"Se lleva por medio de una planeación mensual, responsabilidad del Área de Logística, de acuerdo a los consumos que se generan cada mes. Área de logística envía solicitud de adquisición de medicamentos en el formato estandarizado, por el FNE. De acuerdo a la información de la cotización, se proyecta una orden de compra por parte de la Central De Compras, y el pago es inmediato. Posteriormente, se envía al mensajero a las instalaciones del FNE, con la carta del representante legal firmado, orden de compra, formato cotización y comprobante de pago.  La empresa tercerizada responsable de este servicio de transporte es QUICK, por esta razón lo acompaña un delegado del almacén del Hospital.",Bimestral,Cada dos meses,Si,Sí,No menciona,Algo conforme,Ni conforme ni inconforme,NA,"Una vez los medicamentos son entregados por la empresa de transporte QUICK, la recepción técnica se hace en la Bodega general, por parte del Auxiliar farmacéutico. Hacen verificación del 100% de los productos. Se valida información acerca de las fechas de vencimiento. En esta Bodega general los MME están ubicados en un espacio exclusivo para medicamentos de Alto Costo, cuyo acceso es único para el Auxiliar Farmacéutico.","Se toma evidencia fotográfica y se comenta el caso al FNE, por medio del correo electrónico. Los medicamentos son ubicados en el área de cuarentena",No,No,Manejo De Medicamentos De Control Especial (P-FAR-07),Sí,No ha sucedido,"De acuerdo, si los tiempos de respuesta corresponden con los esperados o acordados y el costo se encuentra dentro de valores normales",Sí,NA,"En la Bodega general los MME están ubicados en un espacio exclusivo para medicamentos de Alto Costo. Aquí están diferenciados como MME y MCE. Esta área está bajo llave y solo el Auxiliar Farmacéutico tiene uso de la llave en la Bodega general. En la farmacia central están almacenados en un gabinete bajo llave con 1 copia, la cual es manejada por los Auxiliares farmacéuticos.",Gabinete exclusivo bajo llave; Acceso de personal restringido,"Bodega General: 1 auxiliar farmacéutico
Farmacias: 5 QFs y 1 auxiliar farmacéutico designado por turno",QF: 5; RF: 0; AF: 1;,Diariamente dos veces al día.,Dos veces al día,"Termohigrómetro, calibrado anualmente",Cada año,"Si. Rojo: menor a 6 meses.
Amarillo: entre 6 - 12 meses
Verde: mayor a 12 meses",Sí,R6,Sí,Mismo gabinete del almacenamiento de MME,"Han tenido casos de vencimiento de medicamento.Se hizo solicitud al FNE por medio del anexo 6. La empresa encargada de destrucción, realizó el procedimiento con el acompañamiento de un delegado del FNE y se consolidó el Acta de Destrucción, para firmar el anexo 7","EcoEntorno, si tiene licencia",EcoEntorno,"Actualmente tienen unidades de medicamentos vencidos en Área de Cuarentena, particularmente de Meperidina. Además, tienen unidades de Hidromorfona en cuarentena, específicamente los lotes relacionados con la alerta sanitaria",Sí,"Inventario diario, cuya información tiene que coincidir con: Unidades físicas, Unidades reportadas en el sistema y unidades reportadas en el libro de controlados.",?,Niveles de inventario mínimo,6,2,"Si, Lorazepam – Alprazolam – Meperidina – Morfina. Razón principal baja rotación",Morfina solución 10mg/mL; Meperidina 100 mg/2mL;,6,35 carros de paro,CP35;,No,No,Aún no. Serviría si corresponden a los estándares GS1,No,"Si aporta a la correcta identificación de los medicamentos para disminuir riesgos, si serviría",No,1,No,NA,NA,NA,NA,Hoja de cálculo formato estándar,NA,"Cada coordinador de cada farmacia (QF), suma los informes del regente, verifica movimientos y consolida la información por farmacia. Estos datos llegan a la farmacia central para ser consolidados de manera general. Una vez consolidado el informe, se envía al Área de Garantía de Calidad, con el fin de revisar datos y obtener el visto bueno. El documento Excel tiene una pestaña asignada por cada farmacia y el consolidado general de todo el Hospital.",1 a 2 días,8-10 día del mes,No,No,"Si, se adelantaron reportes de posible RAM por Hidromorfona y reporte de administración de Oxicodona inyectable",NA,Sí,Sí,"Cada farmacia realiza la solicitud de adecuación de medicamentos a la Central de Mezclas. La Central consolida el número de unidades requeridas en el hospital y posteriormente hace la solicitud de productos al Almacén general. La recepción técnica de estos productos es efectuada por regentes en farmacia. Principalmente se adecuan inyectables con solución salina. A continuación, los medicamentos adecuados:
•	Midazolam
•	Morfina
•	Hidromorfona
•	Ketamina
•	Metadona.",Solución salina + Morfina; Solución salina + Hidromorfona; Solución salina + Metadona,Sí,Eventualmente se hacen preparaciones magistrales para los neonatos que requieren Fenobarbital.,Fenobarbital solución,"Considero que faltan más presentaciones multidosis inyectables, para el uso racional de estos medicamentos, a través de la central de mezclas (como la Morfina 3%)",Algo inconforme,"En el caso de multidosis orales se entrega la unidad de presentación (frasco) para cubrir las necesidades de cada paciente y cuando este egresa, si continua con el tratamiento se le entrega para llevar a casa, de lo contrario se desecha en piso",Sí,"Sí, pero no se maneja por su perfil de seguridad, a los médicos poco les gusta",Sí,Usan tabletas y ampollas. Eventualmente se hacen preparaciones magistrales para los neonatos y cuando estas son requeridas usamos como base la tableta disponible.,Fenobarbital tableta x 10mg; Fenobarbital tableta x 50mg; Fenobarbital tableta x 100mg; Fenobarbital solución 40 mg/mL; Fenobarbital solución 200 mg/mL,"Particularmente para los requerimientos de la Central de Mezclas son más prácticas las formas farmacéuticas “Multidosis” que permita obtener varias unidades adecuadas a partir de un único producto. Por ejemplo, la Morfina 600 mg era mejor.",Sí,Ninguna,No,NA,Muy conforme,La respuesta es oportuna,Ninguna,El oficio donde se notificó la visita técnica por parte del FNE llegó a la carpeta spam,No,Ninguna
