14,Jhonathan Venegas,CEDIS CAFAM,2021-12-06T16:59:17Z,2021-11-05T00:00:00Z,OL,Yoaris Caraballo,NA,Cundinamarca-Funza,KM 7.5 Autopista Medellín 131 -16 – 18,medcontrolespgnm@cafam.com.co,6478980 Ext 11260,Yoaris Caraballo,6478980 Ext 11260,medcontrolespgnm@cafam.com.co,33,QF: 0; RF: 33; AF: 0;,Si,Sí,Sí,"Si Una vez al año, se hacen una revisión de todos los informes a nivel global, también cuando hay aperturas y cambio de personal también",Sí,Una vez al año,Sí,No,Muy conforme,Se entera que es mediante MIPRES,Cómo operadores no tienen ningún inconveniente,Neutral,Muy de acuerdo,Positiva,NA,Software,SIGED/WMS,"Telefono, Correo electrónico","Nunca contestan el teléfonos, sienten que hay un un tratamiento diferenciado con otros prestadores.","Para Cundinamarca, la proyección se hace desde DESABASTECIMIENTO, se hace la cotización al fondo. Compras mensuales, ya dependiendo de las cantidades.",Paquete ofimático,Excel,1,Un día,1,1,Les entregan solo en días específicos,Cada mes,Mensualmente,Si,Sí,NA,Muy inconforme,Ni conforme ni inconforme,NA,"Llegan los medicamentos, llega el auxiliar de bodega, contra factura y código interno, el auxiliar de bodega hace entrega contra factura y DT hace validación y verificación, se realiza el ingreso de unidades al sistema, se procede por parte del auxiliar de bodega a hacer la ubicación del área designada para el medicamentos. 

Una persona en la recepción participa una persona, se hace por muestreo.
",Se toman fotos,"Fenobarbital tableta, venia sellado y faltaban dos, filtración, se le da de baja y se envía a destrucción",Sí,N/A,No,"Va un auxiliar de bodega y un regente, va un carro de CFAM, tienen contratado Escolta privado.",N/A,NA,NA,"El área permanece bajo llave, se tiene un formato de control de acceso, para etiquetar con código de barra, tiene cámaras  y vigilancia",Gabinete exclusivo bajo llave; Formato de control de acceso; Cámaras de seguridad,4 regentes,QF: 1; RF: 1; AF: 0;,Monitoreo continuo electrónico satelital,Continuo,sensores electrónicos,Cada año,No,No,NA,Sí,"Una Jaula, se hace acopio nacional, para MME no, para los no MME si.","La destrucción para CENDIS es anual, en regiones, depende el caso",N/A,NA,No,Sí,Por movimientos históricos para cada,?,Comparación con movimientos históricos,12,1,"Morfina todas las presentaciones inyectables. Primidona, Metilfenidato 10mg",Morfina solución 10mg/mL; Primidona tableta x 250mg; Metilfenidato tableta 10mg;,33,N/A,NA,N/A,NA,"Sí, Sería muy bueno",Sí,buena opción,NA,NA,NA,"Es a sus propias droguerías afiliadas, no hay compra, solo distribución 
",33,droguerías CAFAM,Son droguerías asociadas el mismo distribuidor,Hoja de cálculo formato estándar,NA,Se envía es Anexo 12,más de 2 días,8-10 día del mes,No,Sí,No,NA,No,No,no,NA,No,NA,NA,Conforme,Algo conforme,No maneja,NA,NA,No,N/A,NA,No refiere,No,N/A,NA,NA,Muy inconforme,La comunicación es muy poco eficiente,Mejorar los canales de comunicación,NA,No,Mejorar los canales de comunicación
16,Jhonathan Venegas,SIKUANY SAS,2021-12-08T16:59:12Z,2021-11-25T00:00:00Z,OL,Sandra Suba,Oscar Gonzales,Meta,Calle 33 A # 38 - 41 (Villavicencio),compra@sikuanyltda.com.co,3012045889,Sandra Suba,3103364880,calidadyssp@sikuany.com.co,"10 Regentes A nivel departamental, están en los 29 municipios en Meta y en Cáqueza, varias sedes por municipio.",QF: 0; RF: 1; AF: 2;,"Si Para regentes, no para Auxiliares y QF",Sí,Sí,"Si Para regentes, no para Auxiliares y QF, no se vealúan capacitaciones",Sí,Una vez al año,No,No,Algo inconforme,"Sugerencia, que traiga la presentación en la que viene el medicamento, en metadona suelta en frasco y no hay blíster.

Mejorar la descripción de los productos
","Regular, han tenido problemas con algunas instituciones al respecto",Negativa,"Está bien, necesita más capacitación el personal",Positiva,NA,Software,Mantis,Correo electrónico,NA,"Una compra mensual, hay que cotizar en secretaría, la disponibilidad de los medicamentos en Secretaría, la respuesta del fondo en Bogotá ha sido satisfactoria.

El trámite es menos demorado en Bogotá que en la Secretaría.

En la Secretaría los procesos son muy complicados 

Se miran consumos promedio basados en informe, porque en el sistema se ve solo la dispensación, no los traslados, en base a esas salidas

Solicitud a compras, para 3 meses, 20 – 15% incrementado.
",Software,Mantis,1,Un día,1,1,"Compras hace cotización formal, la respuesta es inmediata en pandemia por baja disponibilidad, 2 días re proceso de cotización por disponibilidad, compras solicitaba pre factura, 2 o tres días en la Secretaría, se enviaba oficio y soporte de la consignación ante el fondo. Copiaban correo al Fondo. No hay una autorización formal.

En Bogotá ha dos personas cercanas al gerente, se les envía el oficio, ellos lo traen sin algún contrato de por medio.
",Cada tres meses,Cada tres meses,"100% Fondo
50% Secretaría
",Sí,NA,Muy conforme,Muy conforme,"En el FRE Meta no da Factura, que la persona encargada de los medicamentos de Control sea permanente.","En bodega se hace recepción técnica y hacen ingreso al sistema, militar estándar en ambos procesos, se observa lote, registro sanitario, fechas de vencimiento y estado físico de las cajas y envases",No ha sucedido,"Se envía correo a jefe de bodega, ella reporta a secretaría , fondo y DT",No,No relacionan,No,"se recogen en la Bodega desde Bogotá y un regente desde el servicio, se hace responsable por ese proceso",No,No,NA,Solo la regente de turno tiene acceso al almacenamiento y manejo de MCE,Acceso de personal restringido;,Solo la regente,QF: 1; RF: 1; AF: 0;,2 veces al día,Dos veces al día,"termohigrómetro, calibrado anualmente.",Cada año,"Si Rojo 6 mese amarillo de 11 mese en adelante, verde en adelante",Sí,R6A11,Sí,en un gabinete aparte bajo llave,"Hay un problema con destrucción de medicamentos, actualmente hay acumulación.",no hay,NA,Se necesita asistencia para destrucción de medicamentos,Sí,Tienen en el sistema stock mínimo,?,Comparación con movimientos históricos,3,3,Metilfenidato 10mg,Metilfenidato tableta 10mg;,29,Auditorías internas en cada sede,NA,ninguno a lugar,No,"No usan ese mecanismo, consideran que no estaría mal",No,Hay una visión positiva al respecto,No,1,No,N/A,N/A,"29 sedes propias, se hace compra centralizada",consumo histórico por institución.,Hoja de cálculo formato estándar,NA,A los correos indicados para el envío de informes en el FNE,2 a 4 horas,4-6 día del mes,Sí,Sí,no,NA,No,No,NA,NA,No,NA,NA,Si,Algo conforme,No se usa,NA,"si, no se usa",Sí,NA,NA,No,No,No,No,NA,Muy conforme,Tienen una relación mucho más efectiva que con la Secretaría de Salud departamental,Mejorar la relación FNE- Secretaría de Salud Departamental del Meta,NA,No,Ninguna a lugar
17,Jhonathan Venegas,Fundación Cardioinfantil,2021-12-09T10:28:12Z,2021-11-09T00:00:00Z,IPS,Egdda Vanegas,Fredy Bautista,Bogotá D.C,"Cl. 163a #13B-60, Bogotá, Cundinamarca",evanegas@cardioinfantil.org,(1) 6672727,Hector Alonso Flores,(1) 6672727,notificacionesjudiciales@cardioinfantil.org,"21 QF, 78 auxiliares de farmacia.",QF: 21; RF: 1; AF: 78;,Si,Sí,Sí,"La capacitación se avalúa por gestión humana.

",Sí,Dos veces por año,Sí,Sí,Algo inconforme,Las caídas incluso dentro de Bogotá se dan frecuentemente.,"Percepción MIPRES: el manejo de los MCE puede ser sencillo para el ámbito ambulatorio, pero para cuidados intensivos, requiere fentanilo o midazolam, puede que no sea tan sencillos. Se requieren ajustes de dosificación en cirugías por lo que puede complicarse. Que las moléculas estén ancladas a una presentación existente. No se permite hacer una cancelación adecuada.",Negativa,Puede ser problemático,Negativa,NA,Software,Servintec,"Telefono, Correo electrónico",NA,"Reposición mensual, con históricos de consumo. 45 días de inventario. Por planeación o por necesidad (es cuando un paciente especifico pide un medicamento especial), una vez definida las cantidades, se solicita una aprobación del jefe de compras de cantidades y dinero a desembolsar, se genera orden de compra, solicitud al FNE con anticipo al 100%, se envía a tesorería, tesorería genera el cheque para remitir al FNE, con mensajería se manda a traer la orden de medicamentos",Software,Servintec,1,Un día,NA,1,"Reposición mensual, con históricos de consumo. 45 días de inventario. Por planeación o por necesidad (es cuando un paciente especifico pide un medicamento especial), una vez definida las cantidades, se solicita una aprobación del jefe de compras de cantidades y dinero a desembolsar, se genera orden de compra, solicitud al FNE con anticipo al 100%, se envía a tesorería, tesorería genera el cheque para remitir al FNE, con mensajería se manda a traer la orden de medicamentos",Cada mes se realizan compras,Mensualmente,La mayoría de las veces la solicitud es cubierta en su totalidad,No,No menciona,Algo conforme,Ni conforme ni inconforme,NA,"Se realiza en la farmacia Sedismed, allí hace la recepción técnica un auxiliar de farmacia y las asiste la QF de aseguramiento de calidad. Se hace revisión de 100% de la orden solicitada",No,Se informa a planeación y ellos hacen contacto directo con los proveedores para la gestión de la devolución.,No,NA,No,Va una empresa de transporte privada,No,No,NA,"Oficina con llave, gavetas con llave, marcación de área. Custodiada de turno a turno, con cámaras de seguridad.",Cuarto bajo llave; Gabinete exclusivo bajo llave; Acceso de personal restringido; Cámaras de seguridad; Marcación de área,Solo los auxiliares turno a turno,QF: 1; RF: 1; AF: 0;,tres veces al día,Tres veces al día,termohigrómetro,Cada año,"no hay semaforización, hay sistema de alertas",Sí,NA,Sí,se comparte área de cuarentena con medicamentos no controlados,"Destrucciones y vencimientos: reunión mensual se dan de baja medicamentos vencidos y dañados. En caso de MCE una vez al año se hace informe al FNE, se hace por punto azul.

",PUNTO AZUL,Punto Azul,NA,Sí,Abastecimiento de medicamentos para 30-45 días,45,Niveles de inventario mínimo,12,1,no,NA,3,"Carros de paro: 28, no todos tienen MCE.",CP28,no,No,"Sí, sería bueno que se impelementara, se usa código de barras",Sí,NA,No,1,No,NA,NA,NA,NA,Hoja de cálculo formato estándar,NA,"Cada una de las farmacias entrega prescripciones impresas, entrega a aseguramiento de calidad, revisa todas las prescripciones, se hace arqueo de fórmulas, se hace segunda verificación y se remite la FNE",más de 2 días,8-10 día del mes,Sí,Sí,no,NA,No,Sí,"Mezclas estandarizadas en la central de mezclas, funciona todos los días menos el sábado. Fentanilo, midazolam jeringas prellenas",Solución salina + Fentanilo; Solución salina + Midazolam; Midazolam jeringa; Fentanilo jeringa;,No,NA,NA,bien,Algo conforme,"morfina al 3% daba una facilidad grande, no solo se usaba parenteral sino por vía oral, para pacientes paleativos. Se envía el paciente con el medicamento de morfina gotas, generalmente lo que queda del medicamento se le entrega para que se lo lleve",Sí,no,No,NA,Fenobarbital tableta x 10mg; Fenobarbital tableta x 50mg; Fenobarbital tableta x 100mg; Fenobarbital solución 40 mg/mL; Fenobarbital solución 200 mg/mL; Fenobarbital Solución 0.4%,lineamientos en manejo de magistrales; Más atrás decían de la Morfina solución inyectable,Sí,NA,No,Sería importante que se dieran lineamientos desde el FNE el manejo de magistrales.,Muy conforme,No han tenido inconvenientes con la entrega de medicamentos en general,seguir haciendo estas jornadas,NA,No,NA
18,Jhonathan Venegas,Hospital Universitario La Samaritana,2021-12-09T16:21:40Z,2021-11-16T00:00:00Z,IPS,Mercedes Barrera Botia,NA,Bogotá D.C,"Carrera 8 No. 0-29 Sur, Colombia",NA,NA,Mercedes Barrera Botia,NA,farmacia.reportes@hus.org.co,"5 qf en contacto con mce, dos regentes y auxiliares de farmacia 26",QF: 5; RF: 2; AF: 26;,No,No,No,Anualmente se programan reuniones de equipo primario. Son evaluadas.,Sí,Una vez al año,Sí,No,Algo inconforme,NA,"Mipres tiene sus dificultades con respecto a la educación del prescriptor. Ha habido dificultad por rotación de prescriptores, en dosis, presentación, frecuencia. Es desgastante las correcciones de mipres. Hay aumento de volumen de trabajo para prescripción, tendrían que hacer doble prescripción en dinámica gerencial (plataforma del la institución) y mipres. Lo que generaría reprocesos. Generar responsabilidad de parte de empresas desarrolladoras. Se implementó una herramienta adicional (mipres.com) para dar soporte a facturación.",Negativa,no es favorable,Negativa,NA,Software,Dynamica Gerencial,"Telefono, Correo electrónico",NA,"Farmacia solicita la necesidad, ordenes se compra eficiente, se suben los formatos, se demora dos días la respuesta del fne.  45 días de inventario + consumo histórico en un Excel estandarizado.",No aplica,NA,1,Un día,5,2,"por la plataforma de la tienda virtual de Colombia Compra eficiente se hace todo el proceso, este proceso es muy dependiente del presupuesto que tenga la institución",mensualmente,Mensualmente,si,Sí,NA,Algo conforme,Algo conforme,NA,"Recepción en el almacén, va una persona de logística y un aux de farmacia. Llega y los recibe la regente de la bodega, revisión con militar estándar, se envia a unidosis lo que toque enviar a reempaque (metadona se manda a central de mezcla para dosis unitaria), lo demás a etiquetado (ampollas). Se revisa ampolla por ampolla, se envia a las farmacias. Unidosis  es el nombre de la empresa que del reempaque. Ellos envían novedades",no,Se pasa a área de cuarentena y se notifica al fne,Sí,NA,No,La persona de la bodega,"Seria favorable porque a veces no hay disponibilidad para enviar, una sola resolución para todas las sedes de la samaritana.",Sí,NA,"Cámaras de seguridad, custodia, demarcación entrega turno a turno,",Gabinete exclusivo bajo llave; Acceso de personal restringido; Cámaras de seguridad; Marcación de área,solo los regentes,QF: 1; RF: 1; AF: 0;,Proceso de telemetría a través de un aplicativo genera alertas cuando se dispara por encima de niveles establecidos. Se calibra cada año,Continuo,Termohigrómetro y sensores del aplicativo,Cada año,"No, próximo a vencer se pone sticker rojo. 6 meses. Programa de seguimiento y control a medicamentos próximos a vencer.",No,R6,Sí,Sí,"Todo lo que se vence mensualmente se recoge y se almacena en un área de cuarentena, cuándo se tiene cierto numero se notifica al fne.","No se tiene empresa contratada, el fne recoge los medicamentos. Para el resto de medicamentos se hace un acta con el ing ambiental y el hospital contrata a ecocapital.",EcoCapital,"Cada sede es independiente y hacen sus proyecciones y compras individualmente.

",Sí,NA,NA,Comparación con movimientos históricos,12,1,no,NA,4,carros de paro 22,CP22,no,No,No,No,no,No,1,No,"cada sede del hospital hace su propia proyección, pero la compra es centralizada",2,"Sede Samaritana ZIPAUIRÁ, Hospital Regional de Zipaquirá",tener una sola resolución de MCE,Hoja de cálculo formato estándar,NA,"Lo hace la regente de farmacia, se baja del software, ella la consolida, se pasa a la dt y ella la revisa y se envia al fne. Los soportes se suben al Almeda (sis documental), allí se controla mensualmente.",más de 2 días,4-6 día del mes,Sí,No,"Si, los últimos 6 meses hubo dos casos en desvíos.  Se han dado cuenta porque vienen enfermeras ansiosas a pedir los medicamentos. Solo se entregan mce y mme a jefes de enfermería. Mensualmente se hace inventario por parte de enfermería y farmacia cada 3 meses","Hubo inconvenientes con la hidromorfona contaminada, toco solo con morfina durante varios meses, lo que pudo generar mayor dependencia en pacientes. Ningún caso confirmado de contaminación con hidromorfonas contaminadas.",Sí,Sí,Solo se hacen sólidos en dosis unitaria,NA,No,NA,NA,Están bien,Algo conforme,NA,No,"No se maneja, los servicios de pediátrica el hidrato de cloral era un medicmaento seguro pero ahora y ahora administran midazolam llevandolos a mayor riesgo.",No,NA,Fenobarbital tableta x 10mg; Fenobarbital tableta x 50mg; Fenobarbital tableta x 100mg; Fenobarbital solución 40 mg/mL; Fenobarbital solución 200 mg/mL; Fenobarbital Solución 0.4%,"Ampolla de hidromorfiona viene de dos y las dosis son mucho menores (0,4 o 0,2) que es un desperdicio grande o en otra ff. Si vinieran en jeringa prellena seria mejor. Igualmente, la morfina la presentación de 10 mg y la dosis des de 2 mg.",Sí,NA,No,NA,Algo inconforme,La comunicación no es buena,"La percepción es lejana, seria bueno que se incentivara uso adecuado de opioides. Se ha perdido comunicación entre colegas del fne y las instituciones.",NA,No,NA
19,Jhonathan Venegas,SUBRED SUR BOGOTÁ HOSPITAL EL TUNAL,2021-12-09T17:19:40Z,2021-12-03T00:00:00Z,IPS,Nancy Tavares,NA,Bogotá D.C,Calle 45f # 16ª - 11,Dir.complementarios@subredsur.gov.co,3274444 Ext 132,Nancy Tavares,3274444 Ext 132,dir.complementarios@subredsur.gov.co,"7 QF, 15-18 Regentes 70 Axuilares 48-50 carros de paro.",QF: 7; RF: 18; AF: 70;,si,Sí,No,"2 veces al año, con exámenes a control y monitores",Sí,Dos veces por año,Sí,No,Algo inconforme,MIPRES HA GENERADO MUCHOS PROBLEMAS,"MIPRES HA GENERADO MUCHOS PROBLEMAS, se cae la plataforma, hay incosistencias, hay mipres de contingencia o provisional, por la población que maneja la subred (Vulnerable)",Negativa,no es favorable,Negativa,NA,Software,Dynamica Gerencial,"Telefono, Correo electrónico",NA,"La necesidad dale del servicio, el QF manda la necesidad a bodega, de las diferentes farmacias que se tienen, se manda la necesidad a compras, contratación se encarga de SECOP

Bodega especializada, todo ingresa menos líquidos, de acuerdo a los pedidos que se hacen de forma central, bodega hace controles y consumo promedio, antes de solicitud o pedido, se compara con bodega, administración interviene en la compra, 25 -30 mes, solo el contrato se deja adicionar hasta el 25%, con el fondo hay complicaciones de tiempo, se hace solicitud a contratación, un funcionario hace la solicitud a SECOP.
",Software,Dynamica Gerencial,1,Un día,25,1,"Se envía la necesidad se manda a pedro rubio de la orden de compra, va un regente, el va al FNE y se recogen, se hace la recepción técnica en el sitio, el proceso se realiza mediante tienda virtual de Colombia compra, el proceso por la tienda virtual es ágil en la plataforma, los demorado es la firma d ellos documentos por los ordenadores de gasto del Fondo nacional de Estupefacientes,",1,Mensualmente,NA,Sí,NA,Algo conforme,Muy conforme,NA,"Se hace la recepción técnica en el mismo FNE, con conteo, lotes, caracteristicas físicas, etc.",No ha pasado,Se hace una breve descripción de lo sucedido,No,NA,No,"Va un carro de la Secretaría de Salud, con un regente encargado",no,No,NA,"Gabinetes con llave El acceso está restringido, a médicos y enfermeras",Gabinete exclusivo bajo llave; Acceso de personal restringido;,"Solo el QF y los regentes de farmacia, en la noche hay delegación y lo realizan auxiliares, hay carta de corresponsabilidad",QF: 1; RF: 1; AF: 0;,Tres veces al día,Tres veces al día,termohigrómetro,Cada año,"Manejan semaforización, solos semaforiza rojo a 6 meses",No,R6,Sí,un gabinete separado,NA,NA,NA,NA,Sí,NA,NA,Comparación con movimientos históricos,6,1,no,NA,21,"48-50 carros de paro, se hacen auditorías internas",CP50,no,No,NA,NA,NA,No,1,No,NA,NA,NA,NA,Hoja de cálculo formato estándar,NA,Entre un QF y dos regentes se va llevando un Excel para conteo de las fórmulas .,1 a 2 días,7-8 día del mes,No,No,no,NA,No,No,NA,NA,No,NA,NA,NA,Algo inconforme,NA,No,NA,Sí,NA,Fenobarbital tableta x 10mg; Fenobarbital tableta x 50mg; Fenobarbital tableta x 100mg; Fenobarbital solución 40 mg/mL; Fenobarbital solución 200 mg/mL; Fenobarbital Solución 0.4%,no,No,NA,No,El FNE debería hacer magistrales,Algo inconforme,no hay muhca comunicación,no,no,No,debería el FNE hacer adecuaciones
20,Wilder Estiben Meneses Garavito,MI IPS LLANOS - PARQUE,2021-12-10T16:48:25Z,2021-11-24T00:00:00Z,IPS,Yurani Beltrán,NA,META,Carrera 40 No 32 – 06,farmaciaipselparque@miips.com.co,3174569307,Yurani Beltrán,3174569307,farmaciaipselparque@miips.com.co,"1 Regente
6 auxiliares. solo una auxiliar se encarga de los MCE",QF: 0; RF: 1; AF: 6;,No hay relación contractual para el MCE.,No,No,Si.,Sí,Una vez al año,Sí,No,Muy conforme,Mas fácil la prescripción por parte del médico.,"No se maneja Mipres,",Neutral,NA,Neutral,NA,Software,No describe,Correo electrónico,NA,"Debido a que se compra con pendientes no hay una estimación, es decir, se compra según lo requerido por los pacientes, mas no por un promedio o un histórico.",Software,HEOM,Menos de un día,Menos de un día,30,1.5,"se cotiza ante la Secretaría de Salud para aprobación y compra de los mismos. Se paga en el banco y se va a tesorería para validar el pago. Por último, se va a la oficina del FRE para el reclamo de los medicamentos.",No hay un mes específico,Cada tres meses,Si,Sí,NA,Muy conforme,Muy conforme,NA,"Verificación de cada producto, concentración descrita, lote, fechas de vencimiento. Buenas condiciones. Completos. Ingreso al sistema. Que no hayan fallas físico vs sistema. Militar estándar.",No se ha presentado.,No se ha presentado. Evidencia fotográfica y correo al FNE.,No,PROCEDIMIENTO PARA EL MANEJO DE MEDICAMENTOS DE CONTROL ESPECIAL.,Sí,"La responsable es la regente, quien es la encargada de recoger los medicamentos una vez hecho el proceso de compra.",NA,NA,NA,Vitrina,Vitrina exclusiva bajo llave;,2 auxiliares más.,QF: 1; RF: 1; AF: 0;,"Todos los días,2 veces al día",Dos veces al día,Formato. Termohigrometro.,Cada año,"3 rojo
6 naranja
Mayor a 6 verde",Sí,R3A6,Sí,Sí,"Durante la visita, no se tenía conocimiento, así mismo se le dio directriz de tener comunicación con el FRE para saber quien es la empresa encargada de la destrucción y el debido procedimiento.",No se tiene conocimiento.,NA,"Se comparten circulares de archivo y recambios, hay desconocimiento al respecto.",Sí,3 meses,90,No se tienen reglas de decisión,3,3,"Si, Ritalina 10 mg",Metilfenidato tableta 10mg;,1,Ningún otro,No,No se han presentado.,No,No,No,Mejoraría la identificación y posibles errores durante la dispensación. Aunque el volumen de medicamentos no es muy alto.,Sí,1,No,NA,NA,NA,NA,Hoja de cálculo formato estándar,NA,Se cuenta diario lo del libro y se comprara con sistema y se llana el anexo. Se envía al correo de la secretaria de salud.,1 a 2 días,8-10 día del mes,Sí,No,no,NA,No,No,NA,NA,No,NA,NA,Muy conformes,Muy conforme,Se realiza el calculo respectivo.,Sí,NA,No,NA,Fenobarbital tableta x 10mg;,No,No,No,No,NA,Algo conforme,A veces son muy demorados,Ser mas atentos a las consultas.,Si,Sí,NA
